affiliate,author,cc_text_hi_words,language,text,time,timestamp,title,uuid,cm_outlet_id,post_type,contacts,channelName,thumbnailUrl,audience,broadcast_tz,callsign,cc_text,currency_code,data_source_id,duration,end_time,genre,id,local_publicity,local_audience,local_time,legacy_media,media,program_type,protocol,publicity,source_type,start_time,text_only,timezone,alert_name,alias,author_id,copyright,mime_type,topics,content_url,alert_id,media_outlet_id,media_outlet_id_channel,media_outlet_id_program,sentiment,outlet_logo_url,channel_id,market_id,market_country,market_name,market_rank,market_state,program_id,thumbnail,cc_text_hi,relative_media_url,media_url,media_url_no_highlight
,,"lawrence fink,blackrock,larry fink,laurence fink,black rock",English,"once you go on that's what i think if i took you to the doctors and they took a sample out your arm if we look at your blood cells under a microscope they'll probably began in they're probably you know like the step have you black like <span class=""highlight"">black rock</span> black posted in it guns definitely stamped into may it will be the rest of my life how you share it to me not want i can't do it it's nothing doing it what an incredible day an unusual day for this one question left now",2025-03-28 00:59:00,2025-03-28 04:59:00,BBCREDB,e4872bfd-0f2c-5f15-8f51-f16c00b37001,,,[],BBC Red Button,https://muk29.assets.criticalmention.com/91098/20250328040000/20250328045900.jpg,,Europe/London,BBCREDB,"once you go on that's what i think if i took you to the doctors and they took a sample out your arm if we look at your blood cells under a microscope they'll probably began in they're probably you know like the step have you black like <span class=""highlight"">black rock</span> black posted in it guns definitely stamped into may it will be the rest of my life how you share it to me not want i can't do it it's nothing doing it what an incredible day an unusual day for this one question left now",,1,60,20250328051400,,6426570336311307833,,,"Mar 28, 2025 04:59 AM GMT",http://muk29.assets.criticalmention.com/flv_stream.php?filename=91098%2F20250328040000%2F20250328040000_full.flv&start=3540&duration=60&hmac=dd4440a74488240147eeba02369523497931dab46e825da515d3ee475c943760&exp=1743374236,https://muk29.assets.criticalmention.com/stream.php?channel_id=91098&start=1743137940000&stop=1743138000000&fmt=m3u8&exp=1743374236&user_id=2248&hmac=f91473a706807a1c4f3389f8984d6c6cd34e3794bbd5bfa73618bed668a5370c,,https,,,20250328044400,False,America/New_York,BlackRock / Fink,TV,,,video/x-flv,,,4358,44473,44473.0,,-0.75,https://s3.us-east-2.amazonaws.com/media.cm.com/outlets/44473.jpg,91098,214,United Kingdom,United Kingdom,214,,,https://muk29.assets.criticalmention.com/91098/20250328040000/20250328045900.jpg,,"uuid=e4872bfd-0f2c-5f15-8f51-f16c00b37001&channelId=91098&minTime=20250328044400&maxTime=20250328051400&token=0131da76-3a1a-465a-a39b-88248ca08854&keyword=lawrence%20fink,blackrock,larry%20fink,laurence%20fink,black%20rock","https://app.criticalmention.com/cm/wordplay?uuid=e4872bfd-0f2c-5f15-8f51-f16c00b37001&channelId=91098&minTime=20250328044400&maxTime=20250328051400&token=0131da76-3a1a-465a-a39b-88248ca08854&keyword=lawrence%20fink,blackrock,larry%20fink,laurence%20fink,black%20rock",https://app.criticalmention.com/cm/wordplay?uuid=e4872bfd-0f2c-5f15-8f51-f16c00b37001&channelId=91098&minTime=20250328044400&maxTime=20250328051400&token=0131da76-3a1a-465a-a39b-88248ca08854
H&I,,"lawrence fink,blackrock,larry fink,laurence fink,black rock",English,"angel what is it angel fall studio angel studios just a lot of great things each one of those one of those platforms takes the pie is fixed there's only so many hours in a day and so many eyeballs and so how many views are you going to get each time one of those come in and they create a new wedge it creates more competition in there which ultimately is good for the consumers if it's allowed disney just bought up hulu and now you have these things so eventually everything's probably just <span class=""highlight"">black rock</span> and who knows but but like rock vanguard state street but the viewers are voting with their subscriptions which then in turn people who are buying stocks are voting with their investments and i think that's what speaks louder than anything else in this space so i think again i mentioned earlier in shock waves with maverick top gun maverick like wow it's kind of pro america good movies again that had a strong male leading career you know",2025-03-27 23:38:00,2025-03-28 03:38:00,The Flyover Conservatives,4694a799-af9f-5a4e-a2ab-6daf87054e9e,,Local,[],KNDB,https://nd103.assets.criticalmention.com/3014/20250328030000/20250328033800.jpg,454.0,America/Chicago,KNDB,"angel what is it angel fall studio angel studios just a lot of great things each one of those one of those platforms takes the pie is fixed there's only so many hours in a day and so many eyeballs and so how many views are you going to get each time one of those come in and they create a new wedge it creates more competition in there which ultimately is good for the consumers if it's allowed disney just bought up hulu and now you have these things so eventually everything's probably just <span class=""highlight"">black rock</span> and who knows but but like rock vanguard state street but the viewers are voting with their subscriptions which then in turn people who are buying stocks are voting with their investments and i think that's what speaks louder than anything else in this space so i think again i mentioned earlier in shock waves with maverick top gun maverick like wow it's kind of pro america good movies again that had a strong male leading career you know",USD,1,60,20250328035959,Community Politics,12732078631783397521,123.0,454.0,"Mar 27, 2025 10:38 PM CDT",http://nd103.assets.criticalmention.com/flv_stream.php?filename=3014%2F20250328030000%2F20250328030000_full.flv&start=2280&duration=60&hmac=6660eddf0c7e1b1be7360272084ec6357bab1a95aefcd8f383b02f810014b9e1&exp=1743374236,https://nd103.assets.criticalmention.com/stream.php?channel_id=3014&start=1743133080000&stop=1743133140000&fmt=m3u8&exp=1743374236&user_id=2248&hmac=642c6a5dc68a739134e405322d2fe8a64375356420b20dfca8a7811fc38039cc,Local,https,123.0,Local,20250328030000,False,America/New_York,BlackRock / Fink,TV,,,video/x-flv,,,4358,396802,396802.0,,0.48511141538619995,,3014,157,United States,Minot-Bsmrck-Dcknsn(Wlstn),147,ND,04282771,https://nd103.assets.criticalmention.com/3014/20250328030000/20250328033800.jpg,,"uuid=4694a799-af9f-5a4e-a2ab-6daf87054e9e&channelId=3014&minTime=20250328030000&maxTime=20250328035959&token=0131da76-3a1a-465a-a39b-88248ca08854&keyword=lawrence%20fink,blackrock,larry%20fink,laurence%20fink,black%20rock","https://app.criticalmention.com/cm/wordplay?uuid=4694a799-af9f-5a4e-a2ab-6daf87054e9e&channelId=3014&minTime=20250328030000&maxTime=20250328035959&token=0131da76-3a1a-465a-a39b-88248ca08854&keyword=lawrence%20fink,blackrock,larry%20fink,laurence%20fink,black%20rock",https://app.criticalmention.com/cm/wordplay?uuid=4694a799-af9f-5a4e-a2ab-6daf87054e9e&channelId=3014&minTime=20250328030000&maxTime=20250328035959&token=0131da76-3a1a-465a-a39b-88248ca08854
ABC,,"lawrence fink,blackrock,larry fink,laurence fink,black rock",English,"visitors staying in nearby short-term rentals. Some travelers told me they only learned about the incident through the news. Others said they haven't received any communication from nearby property management. >> Pros and cons on both sides. Awareness is really important, especially if if there are things that we can help contribute to the investigation and things like that. i think that's always helpful sometimes ignorance is bliss. i don't know. i i kind of wish i had known about it, but it's not unsettling to me enough bed. It would prevent me from coming. >> Police say they continue to work with California authorities to piece together the events leading up to this crime and they say there is no immediate threat to the public but encourage anyone with information to come forward. Reporting in Washington City, Tennessee, Chris, abc, 4 news. >> Can and thank you very We're going to take a look outside now over at Southern Utah where pretty nice day there you can see the <span class=""highlight"">Black Rock</span> mixed with the Red Rock creates. What a beautiful scene here on this",2025-03-27 18:35:00,2025-03-27 22:35:00,ABC4 News at 4:30pm,995f23b1-124a-4d91-af87-895ac61e1f52,,Local,[],ABC,https://slc104.assets.criticalmention.com/8239/20250327220000/20250327223500.jpg,8724.0,America/Denver,KTVX,"visitors staying in nearby short-term rentals. Some travelers told me they only learned about the incident through the news. Others said they haven't received any communication from nearby property management. >> Pros and cons on both sides. Awareness is really important, especially if if there are things that we can help contribute to the investigation and things like that. i think that's always helpful sometimes ignorance is bliss. i don't know. i i kind of wish i had known about it, but it's not unsettling to me enough bed. It would prevent me from coming. >> Police say they continue to work with California authorities to piece together the events leading up to this crime and they say there is no immediate threat to the public but encourage anyone with information to come forward. Reporting in Washington City, Tennessee, Chris, abc, 4 news. >> Can and thank you very We're going to take a look outside now over at Southern Utah where pretty nice day there you can see the <span class=""highlight"">Black Rock</span> mixed with the Red Rock creates. What a beautiful scene here on this",USD,1,60,20250327225959,News,14086380603,1386.0,8724.0,"Mar 27, 2025 04:35 PM MDT",http://slc104.assets.criticalmention.com/flv_stream.php?filename=8239%2F20250327220000%2F20250327220000_full.flv&start=2100&duration=60&hmac=2338f3c7d2d2bd62c63d81868ac417aebfa898b73015f510e214e429b6b7a8d5&exp=1743374236,https://slc104.assets.criticalmention.com/stream.php?channel_id=8239&start=1743114900000&stop=1743114960000&fmt=m3u8&exp=1743374236&user_id=2248&hmac=1d1f0251b7da0aaf1d696a82658bef3d9010037beadfa24762a92e8525e1a9a7,Local,https,1386.0,Local,20250327223000,False,America/New_York,BlackRock / Fink,TV,,,video/x-flv,,,4358,22769,22769.0,,0.39535394310951233,https://s3.us-east-2.amazonaws.com/media.cm.com/outlets/22769.jpg,8239,36,United States,Salt Lake City,28,UT,03135257,https://slc104.assets.criticalmention.com/8239/20250327220000/20250327223500.jpg,,"uuid=995f23b1-124a-4d91-af87-895ac61e1f52&channelId=8239&minTime=20250327223000&maxTime=20250327225959&token=0131da76-3a1a-465a-a39b-88248ca08854&keyword=lawrence%20fink,blackrock,larry%20fink,laurence%20fink,black%20rock","https://app.criticalmention.com/cm/wordplay?uuid=995f23b1-124a-4d91-af87-895ac61e1f52&channelId=8239&minTime=20250327223000&maxTime=20250327225959&token=0131da76-3a1a-465a-a39b-88248ca08854&keyword=lawrence%20fink,blackrock,larry%20fink,laurence%20fink,black%20rock",https://app.criticalmention.com/cm/wordplay?uuid=995f23b1-124a-4d91-af87-895ac61e1f52&channelId=8239&minTime=20250327223000&maxTime=20250327225959&token=0131da76-3a1a-465a-a39b-88248ca08854
CNBC World,,"lawrence fink,blackrock,larry fink,laurence fink,black rock",English,"clients ask me how can i afford to buy my next home, but also make sure my current home sells? That's why who you work with matters together with Homelight, we've helped clients win the home of their dreams. Every time . Welcome back. It's Friday here on Squawk Asia. We're continuing to track the fallout from Hong Kong conglomerate ck Hutchison's decision to sell critical port assets to us private equity giant <span class=""highlight"">Blackrock</span>. Beijing had reportedly told Chinese state owned companies to pause deals with any businesses linked to ck Hutch and its billionaire owner, the Hong Kong tycoon Li Ka shing. But according to Hong Kong South China morning post, those reports are untrue. Sources telling the publication the conglomerate and the Hong Kong government are still working together to find a way out of the deal. The sale agreement is right now scheduled to be signed April the 2nd. That's next week when several",2025-03-27 18:27:00,2025-03-27 22:27:00,Squawk Box Asia,7d8f3757-c1d9-4b12-9cac-1ae552343990,,Network,[],CNBC World,https://hac101.assets.criticalmention.com/4502/20250327220000/20250327222700.jpg,,America/New_York,CNBCWLD,"clients ask me how can i afford to buy my next home, but also make sure my current home sells? That's why who you work with matters together with Homelight, we've helped clients win the home of their dreams. Every time . Welcome back. It's Friday here on Squawk Asia. We're continuing to track the fallout from Hong Kong conglomerate ck Hutchison's decision to sell critical port assets to us private equity giant <span class=""highlight"">Blackrock</span>. Beijing had reportedly told Chinese state owned companies to pause deals with any businesses linked to ck Hutch and its billionaire owner, the Hong Kong tycoon Li Ka shing. But according to Hong Kong South China morning post, those reports are untrue. Sources telling the publication the conglomerate and the Hong Kong government are still working together to find a way out of the deal. The sale agreement is right now scheduled to be signed April the 2nd. That's next week when several",,1,60,20250328005959,Bus./financial,14086368921,,,"Mar 27, 2025 06:27 PM EDT",http://hac101.assets.criticalmention.com/flv_stream.php?filename=4502%2F20250327220000%2F20250327220000_full.flv&start=1620&duration=60&hmac=457b49d479b3b40569853e2b5756acd403b57ebe9dcb4e3c6076463d739085d6&exp=1743374236,https://hac101.assets.criticalmention.com/stream.php?channel_id=4502&start=1743114420000&stop=1743114480000&fmt=m3u8&exp=1743374236&user_id=2248&hmac=c0012df03346c51abfd6463dc672aaac9e389a61acfd516023226760dd909711,Network,https,,Network,20250327220000,False,America/New_York,BlackRock / Fink,TV,,,video/x-flv,,,4358,49032,49032.0,,-0.20156383514404297,https://s3.us-east-2.amazonaws.com/media.cm.com/outlets/49032.jpg,4502,211,United States,National Programming,0,,05125675,https://hac101.assets.criticalmention.com/4502/20250327220000/20250327222700.jpg,,"uuid=7d8f3757-c1d9-4b12-9cac-1ae552343990&channelId=4502&minTime=20250327220000&maxTime=20250328005959&token=0131da76-3a1a-465a-a39b-88248ca08854&keyword=lawrence%20fink,blackrock,larry%20fink,laurence%20fink,black%20rock","https://app.criticalmention.com/cm/wordplay?uuid=7d8f3757-c1d9-4b12-9cac-1ae552343990&channelId=4502&minTime=20250327220000&maxTime=20250328005959&token=0131da76-3a1a-465a-a39b-88248ca08854&keyword=lawrence%20fink,blackrock,larry%20fink,laurence%20fink,black%20rock",https://app.criticalmention.com/cm/wordplay?uuid=7d8f3757-c1d9-4b12-9cac-1ae552343990&channelId=4502&minTime=20250327220000&maxTime=20250328005959&token=0131da76-3a1a-465a-a39b-88248ca08854
Yahoo Finance,,"lawrence fink,blackrock,larry fink,laurence fink,black rock",English,"more of that in general. You know corporations putting Bitcoin on their balance sheet. There was a lot of talk about that years ago actually Tesla was one that did it. And people thought that was going to usher in. i think now there's more of a normalization of that. And we're hearing more about that. And frankly <span class=""highlight"">Blackrock</span> starting to put Bitcoin in their model portfolios i think has been a big catalyst kind of normalizing that idea. Now the flip side of it is, you know, GameStop is, you know, kind of famously known as that meme stock. To what degree was this done for headline grabs and things like that? i think that's why the prices responding the way it is. But generally that type of movement, i think is favorable. And i think we'll see it with countries too. i think we'll start to see, similar to El Salvador, more countries using Bitcoin as a kind of easy, turnkey way to shore up their own central banks. So again, that's another positive catalyst. >> Let me get a broader question for you. I'm looking at Bitcoin. We're still roughly been 20% below that record in January. What are the catalysts to get Bitcoin working in the right direction again that you see coming. >> So the big one is just getting through these macro headwinds. You know Bitcoin is trading like a high beta asset. If you look at a chart of Bitcoin relative to Nasdaq it looks exactly like that a high beta version of the Nasdaq. And so the same headwinds that are kind of taking risk off the table pretty much",2025-03-27 17:51:00,2025-03-27 21:51:00,YAHOOFI,c1865af6-a395-4cd7-8dc3-c8576d0a0a57,,,[],Yahoo Finance,https://bos104.assets.criticalmention.com/90950/20250327210000/20250327215100.jpg,,America/New_York,YAHOOFI,"more of that in general. You know corporations putting Bitcoin on their balance sheet. There was a lot of talk about that years ago actually Tesla was one that did it. And people thought that was going to usher in. i think now there's more of a normalization of that. And we're hearing more about that. And frankly <span class=""highlight"">Blackrock</span> starting to put Bitcoin in their model portfolios i think has been a big catalyst kind of normalizing that idea. Now the flip side of it is, you know, GameStop is, you know, kind of famously known as that meme stock. To what degree was this done for headline grabs and things like that? i think that's why the prices responding the way it is. But generally that type of movement, i think is favorable. And i think we'll see it with countries too. i think we'll start to see, similar to El Salvador, more countries using Bitcoin as a kind of easy, turnkey way to shore up their own central banks. So again, that's another positive catalyst. >> Let me get a broader question for you. I'm looking at Bitcoin. We're still roughly been 20% below that record in January. What are the catalysts to get Bitcoin working in the right direction again that you see coming. >> So the big one is just getting through these macro headwinds. You know Bitcoin is trading like a high beta asset. If you look at a chart of Bitcoin relative to Nasdaq it looks exactly like that a high beta version of the Nasdaq. And so the same headwinds that are kind of taking risk off the table pretty much",,1,60,20250327220600,,14086318767,,,"Mar 27, 2025 05:51 PM EDT",http://bos104.assets.criticalmention.com/flv_stream.php?filename=90950%2F20250327210000%2F20250327210000_full.flv&start=3060&duration=60&hmac=d0187f9a6ee11aaa43057de9eb02aed2a7b6ef97c877e2120d7dc687766f332e&exp=1743374236,https://bos104.assets.criticalmention.com/stream.php?channel_id=90950&start=1743112260000&stop=1743112320000&fmt=m3u8&exp=1743374236&user_id=2248&hmac=95f915d6b8ac03b9bad98abb07af9e13a36fe98398840c343b57a4c3a365803e,,https,,,20250327213600,False,America/New_York,BlackRock / Fink,TV,,,video/x-flv,,,4358,320467,320467.0,,0.13096126914024353,https://pbs.twimg.com/profile_images/1765436373400424448/fr0rdvDa.jpg,90950,211,United States,National Programming,0,,,https://bos104.assets.criticalmention.com/90950/20250327210000/20250327215100.jpg,,"uuid=c1865af6-a395-4cd7-8dc3-c8576d0a0a57&channelId=90950&minTime=20250327213600&maxTime=20250327220600&token=0131da76-3a1a-465a-a39b-88248ca08854&keyword=lawrence%20fink,blackrock,larry%20fink,laurence%20fink,black%20rock","https://app.criticalmention.com/cm/wordplay?uuid=c1865af6-a395-4cd7-8dc3-c8576d0a0a57&channelId=90950&minTime=20250327213600&maxTime=20250327220600&token=0131da76-3a1a-465a-a39b-88248ca08854&keyword=lawrence%20fink,blackrock,larry%20fink,laurence%20fink,black%20rock",https://app.criticalmention.com/cm/wordplay?uuid=c1865af6-a395-4cd7-8dc3-c8576d0a0a57&channelId=90950&minTime=20250327213600&maxTime=20250327220600&token=0131da76-3a1a-465a-a39b-88248ca08854
,,"lawrence fink,blackrock,larry fink,laurence fink,black rock",English,"once it's gone gone that's what i think if i took you to the doctors and they took a sample out your arm if we look at your blood cells into a microscope they'll probably begun in the probably you know like the step have you black like <span class=""highlight"">black rock</span> black stamped in it guns definitely stamped into me it will be for the rest of my life how you've seen it tell me i not want to i can't do it it's nothing doing it what an incredible day an unusual day for this one question left no",2025-03-27 16:57:00,2025-03-27 20:57:00,BBCREDB,1e4b2684-e551-5c41-9945-eab3323d8b2f,,,[],BBC Red Button,https://muk29.assets.criticalmention.com/91098/20250327200000/20250327205700.jpg,,Europe/London,BBCREDB,"once it's gone gone that's what i think if i took you to the doctors and they took a sample out your arm if we look at your blood cells into a microscope they'll probably begun in the probably you know like the step have you black like <span class=""highlight"">black rock</span> black stamped in it guns definitely stamped into me it will be for the rest of my life how you've seen it tell me i not want to i can't do it it's nothing doing it what an incredible day an unusual day for this one question left no",,1,60,20250327211200,,6884690724794445524,,,"Mar 27, 2025 08:57 PM GMT",http://muk29.assets.criticalmention.com/flv_stream.php?filename=91098%2F20250327200000%2F20250327200000_full.flv&start=3420&duration=60&hmac=d8a2f7ce79d8d8b3ddd603f48ca872d419b92e62adf1de8bfca25cbc9a19a938&exp=1743374236,https://muk29.assets.criticalmention.com/stream.php?channel_id=91098&start=1743109020000&stop=1743109080000&fmt=m3u8&exp=1743374236&user_id=2248&hmac=225548e2617e56e9c1da4948ea490bcd49f403167a50ab52c443851fd663a62a,,https,,,20250327204200,False,America/New_York,BlackRock / Fink,TV,,,video/x-flv,,,4358,44473,44473.0,,-0.75,https://s3.us-east-2.amazonaws.com/media.cm.com/outlets/44473.jpg,91098,214,United Kingdom,United Kingdom,214,,,https://muk29.assets.criticalmention.com/91098/20250327200000/20250327205700.jpg,,"uuid=1e4b2684-e551-5c41-9945-eab3323d8b2f&channelId=91098&minTime=20250327204200&maxTime=20250327211200&token=0131da76-3a1a-465a-a39b-88248ca08854&keyword=lawrence%20fink,blackrock,larry%20fink,laurence%20fink,black%20rock","https://app.criticalmention.com/cm/wordplay?uuid=1e4b2684-e551-5c41-9945-eab3323d8b2f&channelId=91098&minTime=20250327204200&maxTime=20250327211200&token=0131da76-3a1a-465a-a39b-88248ca08854&keyword=lawrence%20fink,blackrock,larry%20fink,laurence%20fink,black%20rock",https://app.criticalmention.com/cm/wordplay?uuid=1e4b2684-e551-5c41-9945-eab3323d8b2f&channelId=91098&minTime=20250327204200&maxTime=20250327211200&token=0131da76-3a1a-465a-a39b-88248ca08854
