affiliate,author,cc_text_hi_words,language,text,time,timestamp,title,uuid,cm_outlet_id,post_type,contacts,channelName,thumbnailUrl,audience,broadcast_tz,callsign,cc_text,currency_code,data_source_id,duration,end_time,genre,id,local_publicity,local_audience,local_time,legacy_media,media,program_type,protocol,publicity,source_type,start_time,text_only,timezone,alert_name,alias,author_id,copyright,mime_type,topics,content_url,alert_id,media_outlet_id,media_outlet_id_channel,media_outlet_id_program,sentiment,outlet_logo_url,channel_id,market_id,market_country,market_name,market_rank,market_state,program_id,thumbnail,cc_text_hi,relative_media_url,media_url,media_url_no_highlight
PBS,,"lawrence fink,blackrock,larry fink,laurence fink,black rock",English,"Attracting big business to a small city is no small feat, but the business development board of Palm Beach County has it all figured out. (lively music) - i had the good fortune of growing up here, so if anyone's seen growth, born and raised right down the street. And Palm Beach County really in the last 15 years has been focused on diversifying Palm Beach County's economy because for 50 years this economy has built on tourism, agriculture, and construction, and now is leaning more towards this massive transformation of bringing in Wall Street South companies, a more diversified economy, and higher paying jobs. When <span class=""highlight"">BlackRock</span>, Citadel, and Goldman Sachs, the titans of the financial industry landed here, it opened up the gates for Wall Street. - [Frank] You're bringing in many more people, what's housing been like? - So that has been the difference that we felt in the economic transformation in that a lot of the growth now is coming in from the outside, where before it was growth from within the county.",2025-03-29 16:02:00,2025-03-29 20:02:00,On the Town in the Palm Beaches,59899083-a3ac-4667-a4ef-ac43c7deecff,,Local,"[{'first_name': 'Frank', 'last_name': 'Licari', 'roles': ['Host'], 'contact_id': None}]",PBS,https://mia102.assets.criticalmention.com/4069/20250329200000/20250329200200.jpg,,America/New_York,WXELDT,"Attracting big business to a small city is no small feat, but the business development board of Palm Beach County has it all figured out. (lively music) - i had the good fortune of growing up here, so if anyone's seen growth, born and raised right down the street. And Palm Beach County really in the last 15 years has been focused on diversifying Palm Beach County's economy because for 50 years this economy has built on tourism, agriculture, and construction, and now is leaning more towards this massive transformation of bringing in Wall Street South companies, a more diversified economy, and higher paying jobs. When <span class=""highlight"">BlackRock</span>, Citadel, and Goldman Sachs, the titans of the financial industry landed here, it opened up the gates for Wall Street. - [Frank] You're bringing in many more people, what's housing been like? - So that has been the difference that we felt in the economic transformation in that a lot of the growth now is coming in from the outside, where before it was growth from within the county.",USD,1,60,20250329202959,Travel Community,14090241879,,,"Mar 29, 2025 04:02 PM EDT",http://mia102.assets.criticalmention.com/flv_stream.php?filename=4069%2F20250329200000%2F20250329200000_full.flv&start=120&duration=60&hmac=a19ebfd42dab7a2cbbf641bb66bc39a39f668f2b5c8bce42b3113b6169e6324d&exp=1743374236,https://mia102.assets.criticalmention.com/stream.php?channel_id=4069&start=1743278520000&stop=1743278580000&fmt=m3u8&exp=1743374236&user_id=2248&hmac=28320ea007bde2b7aeb8efef45d082ace12e4858159d32eedfe1f455deb35611,Local,https,,Local,20250329200000,False,America/New_York,BlackRock / Fink,TV,,,video/x-flv,,,4358,,,,0.2609019875526428,,4069,39,United States,West Palm Beach,39,FL,02709520,https://mia102.assets.criticalmention.com/4069/20250329200000/20250329200200.jpg,,"uuid=59899083-a3ac-4667-a4ef-ac43c7deecff&channelId=4069&minTime=20250329200000&maxTime=20250329202959&token=0131da76-3a1a-465a-a39b-88248ca08854&keyword=lawrence%20fink,blackrock,larry%20fink,laurence%20fink,black%20rock","https://app.criticalmention.com/cm/wordplay?uuid=59899083-a3ac-4667-a4ef-ac43c7deecff&channelId=4069&minTime=20250329200000&maxTime=20250329202959&token=0131da76-3a1a-465a-a39b-88248ca08854&keyword=lawrence%20fink,blackrock,larry%20fink,laurence%20fink,black%20rock",https://app.criticalmention.com/cm/wordplay?uuid=59899083-a3ac-4667-a4ef-ac43c7deecff&channelId=4069&minTime=20250329200000&maxTime=20250329202959&token=0131da76-3a1a-465a-a39b-88248ca08854
The Weather Channel,,"lawrence fink,blackrock,larry fink,laurence fink,black rock",English,"Serena, the biologist in charge of the project, is anxious to get to work. - So we're at Point Pleasant Park, just off <span class=""highlight"">Black Rock</span> beach. There is already 60 reef balls here at the site. We're adding on the 50 reef balls to this site. We're gonna hopefully have them attached to the reef that's already there. - Garry's having a hard time getting the barge in exactly the right spot to drop the reef balls. - See, you see, my problem is this anchor is not that way, so i can't pull myself in. i can only pull myself sideways. - And we can't move this barge? - Well, we can't do anything unless we, well, yeah, i guess we can move that barge forward, but then we're over our anchor line is only thing. It might be all right. - Garry, why don't we try that? Try swinging it around? - It's noon. - It's noon, and we haven't started yet. - Nothing like working under pressure. - i can feel the crunch today, and i think it's also because of Dorian coming.",2025-03-29 14:16:00,2025-03-29 18:16:00,Lords of the Ocean,f7dc752b-483c-400e-b581-0d9fbb5fd83c,,Network,[],The Weather Channel,https://ny126.assets.criticalmention.com/967/20250329180000/20250329181600.jpg,50418.0,America/New_York,WEATH,"Serena, the biologist in charge of the project, is anxious to get to work. - So we're at Point Pleasant Park, just off <span class=""highlight"">Black Rock</span> beach. There is already 60 reef balls here at the site. We're adding on the 50 reef balls to this site. We're gonna hopefully have them attached to the reef that's already there. - Garry's having a hard time getting the barge in exactly the right spot to drop the reef balls. - See, you see, my problem is this anchor is not that way, so i can't pull myself in. i can only pull myself sideways. - And we can't move this barge? - Well, we can't do anything unless we, well, yeah, i guess we can move that barge forward, but then we're over our anchor line is only thing. It might be all right. - Garry, why don't we try that? Try swinging it around? - It's noon. - It's noon, and we haven't started yet. - Nothing like working under pressure. - i can feel the crunch today, and i think it's also because of Dorian coming.",USD,1,60,20250329185959,Outdoors,14090089945,,,"Mar 29, 2025 02:16 PM EDT",http://ny126.assets.criticalmention.com/flv_stream.php?filename=967%2F20250329180000%2F20250329180000_full.flv&start=960&duration=60&hmac=18982f47222b55d0a0cbebb1434a966f41468ca2d3d24e6461055173c038a89f&exp=1743374236,https://ny126.assets.criticalmention.com/stream.php?channel_id=967&start=1743272160000&stop=1743272220000&fmt=m3u8&exp=1743374236&user_id=2248&hmac=8ffd201ea98edbe36201fb096687a537e691b28a777d4621976de8d92192c186,Network,https,4933.0,Network,20250329180000,False,America/New_York,BlackRock / Fink,TV,,,video/x-flv,,,4358,40265,40265.0,,-0.10581937432289124,https://pbs.twimg.com/profile_images/1630568271668813824/1Ja_AhCm.jpg,967,211,United States,National Programming,0,,03579911,https://ny126.assets.criticalmention.com/967/20250329180000/20250329181600.jpg,,"uuid=f7dc752b-483c-400e-b581-0d9fbb5fd83c&channelId=967&minTime=20250329180000&maxTime=20250329185959&token=0131da76-3a1a-465a-a39b-88248ca08854&keyword=lawrence%20fink,blackrock,larry%20fink,laurence%20fink,black%20rock","https://app.criticalmention.com/cm/wordplay?uuid=f7dc752b-483c-400e-b581-0d9fbb5fd83c&channelId=967&minTime=20250329180000&maxTime=20250329185959&token=0131da76-3a1a-465a-a39b-88248ca08854&keyword=lawrence%20fink,blackrock,larry%20fink,laurence%20fink,black%20rock",https://app.criticalmention.com/cm/wordplay?uuid=f7dc752b-483c-400e-b581-0d9fbb5fd83c&channelId=967&minTime=20250329180000&maxTime=20250329185959&token=0131da76-3a1a-465a-a39b-88248ca08854
,,"lawrence fink,blackrock,larry fink,laurence fink,black rock",English,"? No black lizards. No black rocks. One little old <span class=""highlight"">black rock</span> would sure stand out. It ain't good standing out all alone. The time we rode out here, me and the other replacements, we stopped alongside some big old river. It was real hot. So i-- i waited all night. I've never been in anything so big. There was thousands of fishes all around. Them fishes was-- was all around me. Sure felt funny. There i was, the onliest man. And there was thousands of them fishes.",2025-03-29 12:20:00,2025-03-29 16:20:00,The High Chaparral,9f17aad0-6441-478c-b070-8d9425cdd600,,Syndicated,"[{'first_name': 'Rodolfo', 'last_name': 'Acosta', 'roles': ['Actor'], 'contact_id': None}, {'first_name': 'Don', 'last_name': 'Collier', 'roles': ['Actor'], 'contact_id': None}, {'first_name': 'Roberto', 'last_name': 'Contreras', 'roles': ['Actor'], 'contact_id': None}, {'first_name': 'Linda', 'last_name': 'Cristal', 'roles': ['Actor'], 'contact_id': None}, {'first_name': 'Henry', 'last_name': 'Darrow', 'roles': ['Actor'], 'contact_id': None}, {'first_name': 'David', 'last_name': 'Dortort', 'roles': ['Executive Producer'], 'contact_id': None}, {'first_name': 'Leif', 'last_name': 'Erickson', 'roles': ['Actor'], 'contact_id': None}, {'first_name': 'Bob', 'last_name': 'Hoy', 'roles': ['Actor'], 'contact_id': None}, {'first_name': 'Ted', 'last_name': 'Markland', 'roles': ['Actor'], 'contact_id': None}, {'first_name': 'Cameron', 'last_name': 'Mitchell', 'roles': ['Actor'], 'contact_id': None}, {'first_name': 'John', 'last_name': 'Pickard', 'roles': ['Guest Star'], 'contact_id': None}, {'first_name': 'James', 'last_name': 'Schmerer', 'roles': ['Producer'], 'contact_id': None}, {'first_name': 'Frank', 'last_name': 'Silvera', 'roles': ['Actor'], 'contact_id': None}, {'first_name': 'Mark', 'last_name': 'Slade', 'roles': ['Actor'], 'contact_id': None}, {'first_name': 'Paul', 'last_name': 'Winfield', 'roles': ['Guest Star'], 'contact_id': None}]",INSPIRATION,https://ny117.assets.criticalmention.com/90956/20250329160000/20250329162000.jpg,287414.0,America/New_York,INSP,"? No black lizards. No black rocks. One little old <span class=""highlight"">black rock</span> would sure stand out. It ain't good standing out all alone. The time we rode out here, me and the other replacements, we stopped alongside some big old river. It was real hot. So i-- i waited all night. I've never been in anything so big. There was thousands of fishes all around. Them fishes was-- was all around me. Sure felt funny. There i was, the onliest man. And there was thousands of them fishes.",USD,1,60,20250329165959,Drama Western,14089925314,,,"Mar 29, 2025 12:20 PM EDT",http://ny117.assets.criticalmention.com/flv_stream.php?filename=90956%2F20250329160000%2F20250329160000_full.flv&start=1200&duration=60&hmac=2794a4705b7645e3c6b37508dee9d40c643aa5ee0414b264c3c1e81b18997483&exp=1743374236,https://ny117.assets.criticalmention.com/stream.php?channel_id=90956&start=1743265200000&stop=1743265260000&fmt=m3u8&exp=1743374236&user_id=2248&hmac=6fc6fb48eda7009c84abc46a455b8da367f351121a7df35d8f4b3c88bd74717e,Syndicated,https,30760.0,Syndicated,20250329160000,False,America/New_York,BlackRock / Fink,TV,,,video/x-flv,,,4358,8917,8917.0,,0.2149999886751175,https://pbs.twimg.com/profile_images/1259107581269770240/Kvj97YLj.jpg,90956,211,United States,National Programming,0,,00002080,https://ny117.assets.criticalmention.com/90956/20250329160000/20250329162000.jpg,,"uuid=9f17aad0-6441-478c-b070-8d9425cdd600&channelId=90956&minTime=20250329160000&maxTime=20250329165959&token=0131da76-3a1a-465a-a39b-88248ca08854&keyword=lawrence%20fink,blackrock,larry%20fink,laurence%20fink,black%20rock","https://app.criticalmention.com/cm/wordplay?uuid=9f17aad0-6441-478c-b070-8d9425cdd600&channelId=90956&minTime=20250329160000&maxTime=20250329165959&token=0131da76-3a1a-465a-a39b-88248ca08854&keyword=lawrence%20fink,blackrock,larry%20fink,laurence%20fink,black%20rock",https://app.criticalmention.com/cm/wordplay?uuid=9f17aad0-6441-478c-b070-8d9425cdd600&channelId=90956&minTime=20250329160000&maxTime=20250329165959&token=0131da76-3a1a-465a-a39b-88248ca08854
,,"lawrence fink,blackrock,larry fink,laurence fink,black rock",English,"igen for the liquid my dad was but in the back and didn't know what it's for when i was old i asked him and he said he was a gurney champion so my dad was ten times world burning champion so visually i just followed that tradition turning in a sense is your family legacies it make you proud to be carrying on under percent you don't have these fairs to die out twelve sixty seven kings charter alistair got recognized last year gone well records it's all a place like element and locally for something like this to die out see once you get one that's what i think if i took you to the doctors and they took a sample out your arm if we look at your red blood cells under a microscope they'll probably began in they're probably you know like the stop in have you <span class=""highlight"">black rock</span> black stamped in it guns definitely stamped into me for the rest of my life",2025-03-29 05:32:00,2025-03-29 09:32:00,BBCREDB,be1d74c9-7622-555c-8991-e3af25801824,,,[],BBC Red Button,https://muk29.assets.criticalmention.com/91098/20250329090000/20250329093200.jpg,,Europe/London,BBCREDB,"igen for the liquid my dad was but in the back and didn't know what it's for when i was old i asked him and he said he was a gurney champion so my dad was ten times world burning champion so visually i just followed that tradition turning in a sense is your family legacies it make you proud to be carrying on under percent you don't have these fairs to die out twelve sixty seven kings charter alistair got recognized last year gone well records it's all a place like element and locally for something like this to die out see once you get one that's what i think if i took you to the doctors and they took a sample out your arm if we look at your red blood cells under a microscope they'll probably began in they're probably you know like the stop in have you <span class=""highlight"">black rock</span> black stamped in it guns definitely stamped into me for the rest of my life",,1,60,20250329094700,,1476352863428310072,,,"Mar 29, 2025 09:32 AM GMT",http://muk29.assets.criticalmention.com/flv_stream.php?filename=91098%2F20250329090000%2F20250329090000_full.flv&start=1920&duration=60&hmac=b25cc57634751c2a89b2d145b96e240447b90478a5b2bb0755728f97612b4ba1&exp=1743374236,https://muk29.assets.criticalmention.com/stream.php?channel_id=91098&start=1743240720000&stop=1743240780000&fmt=m3u8&exp=1743374236&user_id=2248&hmac=e37a96fe2c982cfa660cf75c6cca1abd0d01a380c1e5fdbc1d3ea69ce2b77dca,,https,,,20250329091700,False,America/New_York,BlackRock / Fink,TV,,,video/x-flv,,,4358,44473,44473.0,,0.29500001668930054,https://s3.us-east-2.amazonaws.com/media.cm.com/outlets/44473.jpg,91098,214,United Kingdom,United Kingdom,214,,,https://muk29.assets.criticalmention.com/91098/20250329090000/20250329093200.jpg,,"uuid=be1d74c9-7622-555c-8991-e3af25801824&channelId=91098&minTime=20250329091700&maxTime=20250329094700&token=0131da76-3a1a-465a-a39b-88248ca08854&keyword=lawrence%20fink,blackrock,larry%20fink,laurence%20fink,black%20rock","https://app.criticalmention.com/cm/wordplay?uuid=be1d74c9-7622-555c-8991-e3af25801824&channelId=91098&minTime=20250329091700&maxTime=20250329094700&token=0131da76-3a1a-465a-a39b-88248ca08854&keyword=lawrence%20fink,blackrock,larry%20fink,laurence%20fink,black%20rock",https://app.criticalmention.com/cm/wordplay?uuid=be1d74c9-7622-555c-8991-e3af25801824&channelId=91098&minTime=20250329091700&maxTime=20250329094700&token=0131da76-3a1a-465a-a39b-88248ca08854
Sky Sports,,"lawrence fink,blackrock,larry fink,laurence fink,black rock",English,"no city to an incredibly and against city survive results one there was no lost two one division <span class=""highlight"">black rock</span> beach the final table as birth lester and wimbledon back in the top half as newcastle",2025-03-29 04:53:00,2025-03-29 08:53:00,SSPOPL,fc9be822-a2b1-5d6f-9915-3afeeb8bdee9,,,[],Sky Sports Premier League,https://muk22.assets.criticalmention.com/90608/20250329080000/20250329085300.jpg,,Europe/London,SSPOPL,"no city to an incredibly and against city survive results one there was no lost two one division <span class=""highlight"">black rock</span> beach the final table as birth lester and wimbledon back in the top half as newcastle",,1,60,20250329090800,,10880347565066014022,,,"Mar 29, 2025 08:53 AM GMT",http://muk22.assets.criticalmention.com/flv_stream.php?filename=90608%2F20250329080000%2F20250329080000_full.flv&start=3180&duration=60&hmac=13fca6f5e3f058ab75fa00abca94c93d8c44a70afab50bf40acb4fbd858b7185&exp=1743374236,https://muk22.assets.criticalmention.com/stream.php?channel_id=90608&start=1743238380000&stop=1743238440000&fmt=m3u8&exp=1743374236&user_id=2248&hmac=d5aa07d67e4c12470ca1c6fa8fb88b4cf69fde0b8ce873400afd411ef3fa1b79,,https,,,20250329083800,False,America/New_York,BlackRock / Fink,TV,,,video/x-flv,,,4358,47625,47625.0,,-0.2747267186641693,https://pbs.twimg.com/profile_images/1605131097284788224/CfksO7n7.jpg,90608,214,United Kingdom,United Kingdom,214,,,https://muk22.assets.criticalmention.com/90608/20250329080000/20250329085300.jpg,,"uuid=fc9be822-a2b1-5d6f-9915-3afeeb8bdee9&channelId=90608&minTime=20250329083800&maxTime=20250329090800&token=0131da76-3a1a-465a-a39b-88248ca08854&keyword=lawrence%20fink,blackrock,larry%20fink,laurence%20fink,black%20rock","https://app.criticalmention.com/cm/wordplay?uuid=fc9be822-a2b1-5d6f-9915-3afeeb8bdee9&channelId=90608&minTime=20250329083800&maxTime=20250329090800&token=0131da76-3a1a-465a-a39b-88248ca08854&keyword=lawrence%20fink,blackrock,larry%20fink,laurence%20fink,black%20rock",https://app.criticalmention.com/cm/wordplay?uuid=fc9be822-a2b1-5d6f-9915-3afeeb8bdee9&channelId=90608&minTime=20250329083800&maxTime=20250329090800&token=0131da76-3a1a-465a-a39b-88248ca08854
One America News Network,,"lawrence fink,blackrock,larry fink,laurence fink,black rock",English,"to reel in inflation? And quite frankly, do you think that the creation on the on the inverse side, on the other side, do you think that the creation of a government strategic Bitcoin reserve could push Bitcoin prices even higher? Do you do you think do you think we're heading into a very crazy market, i should ask. Well, let me. Yeah, i guess one way i can answer your question, Chris, is by disclosing to you, which i did, i ran for u.s. Senate against Elizabeth Warren and i had to disclose my financials. And i disclosed that 80% of my net worth is in Bitcoin. And so I'm obviously someone who is a firm believer that this asset is going to appreciate. You have targets, you know, of $1,000,000, 500,000 by some of the leading people in the world. Cathie Wood <span class=""highlight"">Larry Fink</span> recently came out and said, 700,000. If our asset managers assign a 1 to 5% allocation rate to their clients. And so when you have those people and also, i should add, Cynthia Loomis, Senator Loomis from Wyoming,",2025-03-29 04:48:00,2025-03-29 08:48:00,OAN Plus,6630866b-d610-4344-8dfb-8fd5404cea7c,,,[],OAN Plus,https://hac107.assets.criticalmention.com/90615/20250329080000/20250329084800.jpg,,America/Los_Angeles,OAN Plus,"to reel in inflation? And quite frankly, do you think that the creation on the on the inverse side, on the other side, do you think that the creation of a government strategic Bitcoin reserve could push Bitcoin prices even higher? Do you do you think do you think we're heading into a very crazy market, i should ask. Well, let me. Yeah, i guess one way i can answer your question, Chris, is by disclosing to you, which i did, i ran for u.s. Senate against Elizabeth Warren and i had to disclose my financials. And i disclosed that 80% of my net worth is in Bitcoin. And so I'm obviously someone who is a firm believer that this asset is going to appreciate. You have targets, you know, of $1,000,000, 500,000 by some of the leading people in the world. Cathie Wood <span class=""highlight"">Larry Fink</span> recently came out and said, 700,000. If our asset managers assign a 1 to 5% allocation rate to their clients. And so when you have those people and also, i should add, Cynthia Loomis, Senator Loomis from Wyoming,",,1,60,20250329090300,,14089284520,,,"Mar 29, 2025 01:48 AM PDT",http://hac107.assets.criticalmention.com/flv_stream.php?filename=90615%2F20250329080000%2F20250329080000_full.flv&start=2880&duration=60&hmac=c5a9bcbcaf471d772fa4682efcc8e7040a3c36e258e3d2b251793f6a42866b06&exp=1743374236,https://hac107.assets.criticalmention.com/stream.php?channel_id=90615&start=1743238080000&stop=1743238140000&fmt=m3u8&exp=1743374236&user_id=2248&hmac=d07f51b036d076f599644535f293ae7219e318076cc869b76937f0e7e94b9f9a,,https,,,20250329083300,False,America/New_York,BlackRock / Fink,TV,,,video/x-flv,,,4358,29177,29177.0,,-0.19999998807907104,https://pbs.twimg.com/profile_images/579744264751448064/DH0xDrdO.jpg,90615,211,United States,National Programming,0,,,https://hac107.assets.criticalmention.com/90615/20250329080000/20250329084800.jpg,,"uuid=6630866b-d610-4344-8dfb-8fd5404cea7c&channelId=90615&minTime=20250329083300&maxTime=20250329090300&token=0131da76-3a1a-465a-a39b-88248ca08854&keyword=lawrence%20fink,blackrock,larry%20fink,laurence%20fink,black%20rock","https://app.criticalmention.com/cm/wordplay?uuid=6630866b-d610-4344-8dfb-8fd5404cea7c&channelId=90615&minTime=20250329083300&maxTime=20250329090300&token=0131da76-3a1a-465a-a39b-88248ca08854&keyword=lawrence%20fink,blackrock,larry%20fink,laurence%20fink,black%20rock",https://app.criticalmention.com/cm/wordplay?uuid=6630866b-d610-4344-8dfb-8fd5404cea7c&channelId=90615&minTime=20250329083300&maxTime=20250329090300&token=0131da76-3a1a-465a-a39b-88248ca08854
