affiliate,author,cc_text_hi_words,language,text,time,timestamp,title,uuid,cm_outlet_id,post_type,contacts,channelName,thumbnailUrl,audience,broadcast_tz,callsign,cc_text,currency_code,data_source_id,duration,end_time,genre,id,local_publicity,local_audience,local_time,legacy_media,media,program_type,protocol,publicity,source_type,start_time,text_only,timezone,alert_name,alias,author_id,copyright,mime_type,topics,content_url,alert_id,media_outlet_id,media_outlet_id_channel,media_outlet_id_program,sentiment,outlet_logo_url,channel_id,market_id,market_country,market_name,market_rank,market_state,program_id,thumbnail,cc_text_hi,relative_media_url,media_url,media_url_no_highlight
NHK World - Japan,,"lawrence fink,blackrock,larry fink,laurence fink,black rock",English,"the two ports to a group that includes the u.s. investment fund <span class=""highlight"">blackrock</span>. the deal was slated to be signed by april 2nd, but hong kong media outlets on friday quoted a source close to the matter as saying ck hutchison will not go ahead with the expected signing. the source says the development does not mean the deal had been called off. ck hutchison has not issued a comment on the media reports, but the deal has raised questions in hong kong's pro-beijing media. some are demanding that it be reviewed, while others are asking whether the conglomerate had taken national interest into account. the hong kong and macau affairs office of china's state council has reposted articles about the issue on its u.s. defense secretary peter texas said advanced military capabilities will be deployed to the philippines, along with joint training to increase deterrence in the indo-pacific region. pete",2025-03-28 22:07:00,2025-03-29 02:07:00,NHK Newsline,655f88d9-98b4-46db-bfa9-475f4138da7f,,Network,[],NHK World - Japan,https://tac104.assets.criticalmention.com/90719/20250329020000/20250329020700.jpg,,Asia/Tokyo,NHKWRLD,"the two ports to a group that includes the u.s. investment fund <span class=""highlight"">blackrock</span>. the deal was slated to be signed by april 2nd, but hong kong media outlets on friday quoted a source close to the matter as saying ck hutchison will not go ahead with the expected signing. the source says the development does not mean the deal had been called off. ck hutchison has not issued a comment on the media reports, but the deal has raised questions in hong kong's pro-beijing media. some are demanding that it be reviewed, while others are asking whether the conglomerate had taken national interest into account. the hong kong and macau affairs office of china's state council has reposted articles about the issue on its u.s. defense secretary peter texas said advanced military capabilities will be deployed to the philippines, along with joint training to increase deterrence in the indo-pacific region. pete",,1,60,20250329020959,News,14088716628,,,"Mar 29, 2025 11:07 AM JST",http://tac104.assets.criticalmention.com/flv_stream.php?filename=90719%2F20250329020000%2F20250329020000_full.flv&start=420&duration=60&hmac=abbf3b804500c58669ddc7abdef7980524d39cedf2d23cd03d7f456739da4366&exp=1743374236,https://tac104.assets.criticalmention.com/stream.php?channel_id=90719&start=1743214020000&stop=1743214080000&fmt=m3u8&exp=1743374236&user_id=2248&hmac=6f7683b801e5b051add73377f24ebe1b479fa778140b49b928db14504c519732,Network,https,,Network,20250329020000,False,America/New_York,BlackRock / Fink,TV,,,video/x-flv,,,4358,396706,396706.0,,0.4866666793823242,,90719,211,United States,National Programming,0,,00365277,https://tac104.assets.criticalmention.com/90719/20250329020000/20250329020700.jpg,,"uuid=655f88d9-98b4-46db-bfa9-475f4138da7f&channelId=90719&minTime=20250329020000&maxTime=20250329020959&token=0131da76-3a1a-465a-a39b-88248ca08854&keyword=lawrence%20fink,blackrock,larry%20fink,laurence%20fink,black%20rock","https://app.criticalmention.com/cm/wordplay?uuid=655f88d9-98b4-46db-bfa9-475f4138da7f&channelId=90719&minTime=20250329020000&maxTime=20250329020959&token=0131da76-3a1a-465a-a39b-88248ca08854&keyword=lawrence%20fink,blackrock,larry%20fink,laurence%20fink,black%20rock",https://app.criticalmention.com/cm/wordplay?uuid=655f88d9-98b4-46db-bfa9-475f4138da7f&channelId=90719&minTime=20250329020000&maxTime=20250329020959&token=0131da76-3a1a-465a-a39b-88248ca08854
NBC,,"lawrence fink,blackrock,larry fink,laurence fink,black rock",English,"it's it's going to be hard to make sure the calls go unanswered. they gave so much for their country, but >> killer worries the country won't be able to give back to them. this was a promise. we promise these men and women to care for them. >> at this point, collins says his department has not decided which employees will be let go. but sources today giving new insight that call centers will be impacted in new york and we an. >> chinese antitrust regulators have been putting the sale of to panama canal ports on hold. they are investigating a u.s. consort hams deal for the ports in the panama cnal zone. the investigation delays. the deal's closing originally set for next week. the deal led by <span class=""highlight"">blackrock</span>. the world's largest asset manager was announced earlier this month. itwas widely viewed as a way to ease tensions in the region. <span class=""highlight"">blackrock</span> agreed t lead a group that won by hong kong from ck hutchinson controlling interest in 43 other ports around the world. lompoc",2025-03-28 21:33:00,2025-03-29 01:33:00,KSBY News at 6:30,3d8a3168-433a-44b5-b4c6-a0932bfdc408,,Local,[],NBC,https://sj115.assets.criticalmention.com/779/20250329010000/20250329013300.jpg,20957.0,America/Los_Angeles,KSBY,"it's it's going to be hard to make sure the calls go unanswered. they gave so much for their country, but >> killer worries the country won't be able to give back to them. this was a promise. we promise these men and women to care for them. >> at this point, collins says his department has not decided which employees will be let go. but sources today giving new insight that call centers will be impacted in new york and we an. >> chinese antitrust regulators have been putting the sale of to panama canal ports on hold. they are investigating a u.s. consort hams deal for the ports in the panama cnal zone. the investigation delays. the deal's closing originally set for next week. the deal led by <span class=""highlight"">blackrock</span>. the world's largest asset manager was announced earlier this month. itwas widely viewed as a way to ease tensions in the region. <span class=""highlight"">blackrock</span> agreed t lead a group that won by hong kong from ck hutchinson controlling interest in 43 other ports around the world. lompoc",USD,1,60,20250329015959,News,14088669856,3934.0,20957.0,"Mar 28, 2025 06:33 PM PDT",http://sj115.assets.criticalmention.com/flv_stream.php?filename=779%2F20250329010000%2F20250329010000_full.flv&start=1980&duration=60&hmac=43317133c560525e77bf84ec6b7b5e6b100d11bc2a91204e449548388c7bea06&exp=1743374236,https://sj115.assets.criticalmention.com/stream.php?channel_id=779&start=1743211980000&stop=1743212040000&fmt=m3u8&exp=1743374236&user_id=2248&hmac=ca8ff33176cd74dc56e161fbbd23c601c658014443c34717cf9f55e3c8c512fd,Local,https,3934.0,Local,20250329013000,False,America/New_York,BlackRock / Fink,TV,,,video/x-flv,,,4358,392868,392868.0,,-0.034346580505371094,https://pbs.twimg.com/profile_images/631946080272252928/13syPbRt.jpg,779,121,United States,Santa Barbara,123,CA,01240280,https://sj115.assets.criticalmention.com/779/20250329010000/20250329013300.jpg,,"uuid=3d8a3168-433a-44b5-b4c6-a0932bfdc408&channelId=779&minTime=20250329013000&maxTime=20250329015959&token=0131da76-3a1a-465a-a39b-88248ca08854&keyword=lawrence%20fink,blackrock,larry%20fink,laurence%20fink,black%20rock","https://app.criticalmention.com/cm/wordplay?uuid=3d8a3168-433a-44b5-b4c6-a0932bfdc408&channelId=779&minTime=20250329013000&maxTime=20250329015959&token=0131da76-3a1a-465a-a39b-88248ca08854&keyword=lawrence%20fink,blackrock,larry%20fink,laurence%20fink,black%20rock",https://app.criticalmention.com/cm/wordplay?uuid=3d8a3168-433a-44b5-b4c6-a0932bfdc408&channelId=779&minTime=20250329013000&maxTime=20250329015959&token=0131da76-3a1a-465a-a39b-88248ca08854
Yahoo Finance,,"lawrence fink,blackrock,larry fink,laurence fink,black rock",English,"Actually Tesla was one that did it. that did it. Um, and people thought Um, and people thought that was gonna usher that was gonna usher in. in. i think now there's i think now there's more of a normalization more of a normalization of that, and we're of that, and we're hearing more about that. hearing more about that. And frankly, <span class=""highlight"">BlackRock</span> starting And frankly, <span class=""highlight"">BlackRock</span> starting to put Bitcoin in to put Bitcoin in their model portfolios, i their model portfolios, i think has been a think has been a big catalyst, kind of big catalyst, kind of normalizing that idea. normalizing that idea. Now, the flip side, Now, the flip side, of course it is, of course it is, you know, GameStop is, you know, GameStop is, you know, kind of you know, kind of famously known as that famously known as that meme stock. meme stock. To what degree was To what degree was this done for headline this done for headline grabs and things like grabs and things like that. that. Mm-hmm . Mm-hmm . i think that's why i think that's why the price is responding the price is responding the way it is. the way it is. But generally that type But generally that type of movement i think of movement i think is, is favorable. is, is favorable. And i think we'll see it with countries too. too. i think we'll start i think we'll start to see, similar to to see, similar to El Salvador, more countries El Salvador, more countries using Bitcoin as a using Bitcoin as a kind of easy, turnkey kind of easy, turnkey way to shore up way to shore up their own central banks. their own central banks. So again, that's another So again, that's another positive catalyst. positive catalyst. Uh, lemme get a Uh, lemme get a broader question for you. broader question for you. Looking at Bitcoin, we're Looking at Bitcoin, we're still roughly been 20% still roughly been 20% below that record in below that record in January. January. What are the catalysts What are the catalysts to get Bitcoin working to get Bitcoin working in the right direction",2025-03-28 19:04:00,2025-03-28 23:04:00,YAHOOFI,cf14243d-9bc2-4412-8171-41864b4ab958,,,[],Yahoo Finance,https://bos104.assets.criticalmention.com/90950/20250328230000/20250328230400.jpg,,America/New_York,YAHOOFI,"Actually Tesla was one that did it. that did it. Um, and people thought Um, and people thought that was gonna usher that was gonna usher in. in. i think now there's i think now there's more of a normalization more of a normalization of that, and we're of that, and we're hearing more about that. hearing more about that. And frankly, <span class=""highlight"">BlackRock</span> starting And frankly, <span class=""highlight"">BlackRock</span> starting to put Bitcoin in to put Bitcoin in their model portfolios, i their model portfolios, i think has been a think has been a big catalyst, kind of big catalyst, kind of normalizing that idea. normalizing that idea. Now, the flip side, Now, the flip side, of course it is, of course it is, you know, GameStop is, you know, GameStop is, you know, kind of you know, kind of famously known as that famously known as that meme stock. meme stock. To what degree was To what degree was this done for headline this done for headline grabs and things like grabs and things like that. that. Mm-hmm . Mm-hmm . i think that's why i think that's why the price is responding the price is responding the way it is. the way it is. But generally that type But generally that type of movement i think of movement i think is, is favorable. is, is favorable. And i think we'll see it with countries too. too. i think we'll start i think we'll start to see, similar to to see, similar to El Salvador, more countries El Salvador, more countries using Bitcoin as a using Bitcoin as a kind of easy, turnkey kind of easy, turnkey way to shore up way to shore up their own central banks. their own central banks. So again, that's another So again, that's another positive catalyst. positive catalyst. Uh, lemme get a Uh, lemme get a broader question for you. broader question for you. Looking at Bitcoin, we're Looking at Bitcoin, we're still roughly been 20% still roughly been 20% below that record in below that record in January. January. What are the catalysts What are the catalysts to get Bitcoin working to get Bitcoin working in the right direction",,1,60,20250328231900,,14088459987,,,"Mar 28, 2025 07:04 PM EDT",http://bos104.assets.criticalmention.com/flv_stream.php?filename=90950%2F20250328230000%2F20250328230000_full.flv&start=240&duration=60&hmac=ee1090242c101b1f25cf11a409641888036a51744f05a4e348c55ae9e657ffbb&exp=1743374236,https://bos104.assets.criticalmention.com/stream.php?channel_id=90950&start=1743203040000&stop=1743203100000&fmt=m3u8&exp=1743374236&user_id=2248&hmac=7f3ebc41eba22057465af94a49e4e809b8676f026e228b0eecf3a290634e11c9,,https,,,20250328224900,False,America/New_York,BlackRock / Fink,TV,,,video/x-flv,,,4358,320467,320467.0,,0.07403814792633057,https://pbs.twimg.com/profile_images/1765436373400424448/fr0rdvDa.jpg,90950,211,United States,National Programming,0,,,https://bos104.assets.criticalmention.com/90950/20250328230000/20250328230400.jpg,,"uuid=cf14243d-9bc2-4412-8171-41864b4ab958&channelId=90950&minTime=20250328224900&maxTime=20250328231900&token=0131da76-3a1a-465a-a39b-88248ca08854&keyword=lawrence%20fink,blackrock,larry%20fink,laurence%20fink,black%20rock","https://app.criticalmention.com/cm/wordplay?uuid=cf14243d-9bc2-4412-8171-41864b4ab958&channelId=90950&minTime=20250328224900&maxTime=20250328231900&token=0131da76-3a1a-465a-a39b-88248ca08854&keyword=lawrence%20fink,blackrock,larry%20fink,laurence%20fink,black%20rock",https://app.criticalmention.com/cm/wordplay?uuid=cf14243d-9bc2-4412-8171-41864b4ab958&channelId=90950&minTime=20250328224900&maxTime=20250328231900&token=0131da76-3a1a-465a-a39b-88248ca08854
NBC,,"lawrence fink,blackrock,larry fink,laurence fink,black rock",English,"weeks. the trump administration has been working to dismantle the agency and freeze almost all foreign assistance pending a review of those programs. thousands of u.s. aid employees have been fired or put on leave and bilions of dollars in aid of contracts have been canceled. less than 900 usaid employees remained on the job as of last week. well, chinese antitrust regulators have put the cell of to panama canal ports on hold. they're investigating a u.s. consortium's deal for the ports in the panama canal zone. the investigation delays, the deal's closing originally set for next week. the deal led by <span class=""highlight"">blackrock</span>. the world's largest asset manager was announced earlier this month. it was widely viewed as a way to ease tensions in the region. <span class=""highlight"">blackrock</span> agreed to lead a group that would buy hong kong firm. ck huntington's controlling interest in 43 other ports",2025-03-28 19:03:00,2025-03-28 23:03:00,Erie News Now at 7pm,ad176af6-f9a9-4f90-9f9e-6d6ac846e109,,Local,[],NBC,https://erie102.assets.criticalmention.com/1149/20250328230000/20250328230300.jpg,9158.0,America/New_York,WICU,"weeks. the trump administration has been working to dismantle the agency and freeze almost all foreign assistance pending a review of those programs. thousands of u.s. aid employees have been fired or put on leave and bilions of dollars in aid of contracts have been canceled. less than 900 usaid employees remained on the job as of last week. well, chinese antitrust regulators have put the cell of to panama canal ports on hold. they're investigating a u.s. consortium's deal for the ports in the panama canal zone. the investigation delays, the deal's closing originally set for next week. the deal led by <span class=""highlight"">blackrock</span>. the world's largest asset manager was announced earlier this month. it was widely viewed as a way to ease tensions in the region. <span class=""highlight"">blackrock</span> agreed to lead a group that would buy hong kong firm. ck huntington's controlling interest in 43 other ports",USD,1,60,20250328232959,News,14088457546,1993.0,9158.0,"Mar 28, 2025 07:03 PM EDT",http://erie102.assets.criticalmention.com/flv_stream.php?filename=1149%2F20250328230000%2F20250328230000_full.flv&start=180&duration=60&hmac=5d9f6bfdb674f2af288d746b3624468980ff00cf30bd0738337d77dcb7c3ee6d&exp=1743374236,https://erie102.assets.criticalmention.com/stream.php?channel_id=1149&start=1743202980000&stop=1743203040000&fmt=m3u8&exp=1743374236&user_id=2248&hmac=1423f72c2f49ffe2450b28beca62a9c1560f6776b81f5e496d7f203be30c4c5a,Local,https,1993.0,Local,20250328230000,False,America/New_York,BlackRock / Fink,TV,,,video/x-flv,,,4358,50320,50320.0,,-0.04499998688697815,https://pbs.twimg.com/profile_images/1007875862539235328/ALse5zKK.jpg,1149,142,United States,Erie,154,PA,02411343,https://erie102.assets.criticalmention.com/1149/20250328230000/20250328230300.jpg,,"uuid=ad176af6-f9a9-4f90-9f9e-6d6ac846e109&channelId=1149&minTime=20250328230000&maxTime=20250328232959&token=0131da76-3a1a-465a-a39b-88248ca08854&keyword=lawrence%20fink,blackrock,larry%20fink,laurence%20fink,black%20rock","https://app.criticalmention.com/cm/wordplay?uuid=ad176af6-f9a9-4f90-9f9e-6d6ac846e109&channelId=1149&minTime=20250328230000&maxTime=20250328232959&token=0131da76-3a1a-465a-a39b-88248ca08854&keyword=lawrence%20fink,blackrock,larry%20fink,laurence%20fink,black%20rock",https://app.criticalmention.com/cm/wordplay?uuid=ad176af6-f9a9-4f90-9f9e-6d6ac846e109&channelId=1149&minTime=20250328230000&maxTime=20250328232959&token=0131da76-3a1a-465a-a39b-88248ca08854
CBS,,"lawrence fink,blackrock,larry fink,laurence fink,black rock",English,"people to sign up with a bank account in order to avoid potential credit card processing fees. chinese antitrust regulators have put the sale of two panama canal ports on hold. they are investigating a u-s consortium's deal for the ports in the panama canal zone. the investigation delays the deal's closing -- originally set for next week. the deal, led by <span class=""highlight"">blackrock</span>, the world's largest asset manager, was announced earlier this month. it was widely viewed as a way to ease tensions in the region. <span class=""highlight"">blackrock</span> agreed to lead a group that would buy hong kong firm c-k hutchison's controlling interest in 43 other ports around the world. more local news -- mount pleasant is asking residents for input on its next master plan. the master plan is a policy document detailing the direction for the city's development in the next 30 years. mount pleasant wants residents to answer questions like what it wants the community",2025-03-28 18:17:00,2025-03-28 22:17:00,WNEM TV-5 News at 6,1b57f9bf-8281-442d-b694-c68d1a694b03,,Local,[],CBS,https://mi112.assets.criticalmention.com/352/20250328220000/20250328221700.jpg,41272.0,America/New_York,WNEM,"people to sign up with a bank account in order to avoid potential credit card processing fees. chinese antitrust regulators have put the sale of two panama canal ports on hold. they are investigating a u-s consortium's deal for the ports in the panama canal zone. the investigation delays the deal's closing -- originally set for next week. the deal, led by <span class=""highlight"">blackrock</span>, the world's largest asset manager, was announced earlier this month. it was widely viewed as a way to ease tensions in the region. <span class=""highlight"">blackrock</span> agreed to lead a group that would buy hong kong firm c-k hutchison's controlling interest in 43 other ports around the world. more local news -- mount pleasant is asking residents for input on its next master plan. the master plan is a policy document detailing the direction for the city's development in the next 30 years. mount pleasant wants residents to answer questions like what it wants the community",USD,1,60,20250328222959,News,14088392521,3780.0,41272.0,"Mar 28, 2025 06:17 PM EDT",http://mi112.assets.criticalmention.com/flv_stream.php?filename=352%2F20250328220000%2F20250328220000_full.flv&start=1020&duration=60&hmac=c9fa49da111712d560b70d733facb0dda23d88f9a8dfe531b2dc9c14000cd9f9&exp=1743374236,https://mi112.assets.criticalmention.com/stream.php?channel_id=352&start=1743200220000&stop=1743200280000&fmt=m3u8&exp=1743374236&user_id=2248&hmac=6c3f02ec681d70c3f5e3580d3c19c6909bd91cd7f6e20e2ef0d780c36a378cb4,Local,https,3780.0,Local,20250328220000,False,America/New_York,BlackRock / Fink,TV,,,video/x-flv,,,4358,42149,42149.0,,0.550000011920929,,352,65,United States,Flint,72,MI,00834149,https://mi112.assets.criticalmention.com/352/20250328220000/20250328221700.jpg,,"uuid=1b57f9bf-8281-442d-b694-c68d1a694b03&channelId=352&minTime=20250328220000&maxTime=20250328222959&token=0131da76-3a1a-465a-a39b-88248ca08854&keyword=lawrence%20fink,blackrock,larry%20fink,laurence%20fink,black%20rock","https://app.criticalmention.com/cm/wordplay?uuid=1b57f9bf-8281-442d-b694-c68d1a694b03&channelId=352&minTime=20250328220000&maxTime=20250328222959&token=0131da76-3a1a-465a-a39b-88248ca08854&keyword=lawrence%20fink,blackrock,larry%20fink,laurence%20fink,black%20rock",https://app.criticalmention.com/cm/wordplay?uuid=1b57f9bf-8281-442d-b694-c68d1a694b03&channelId=352&minTime=20250328220000&maxTime=20250328222959&token=0131da76-3a1a-465a-a39b-88248ca08854
ABC,,"lawrence fink,blackrock,larry fink,laurence fink,black rock",English,"outbreak of stronger tornadoes. we've got what's likely a strong tornado on the ground here north of diaz. what made march 14th so different was not the number of tornadoes, but the strength of them. 15 tornadoes cut paths across arkansas. ten of them were ef2 or stronger. the evening began with a supercell spawning a tornado in baxter county near the missouri border, and then a monster supercell that crossed us 65 near leslie put down a large ef four tornado that went through 56 bellevue and violet hill before lifting southeast of ash flat. this tornado was over three fourths of a mile wide. confirmed large tornado. this is likely a strong tornado just calling out a few places that likely could have been impacted. this storm went on a short time later to produce another large ef three tornado that tore through ravenden springs before moving into missouri. the next round of storms dropped to ef three tornado that moved through cushman cave city, <span class=""highlight"">blackrock</span>, and rainbow before lifting",2025-03-28 18:16:00,2025-03-28 22:16:00,Channel 7 News at 5pm,335580c2-00ca-4c54-96f5-a4606c9cda73,,Local,[],ABC,https://lr101.assets.criticalmention.com/76/20250328220000/20250328221600.jpg,71200.0,America/Chicago,KATV,"outbreak of stronger tornadoes. we've got what's likely a strong tornado on the ground here north of diaz. what made march 14th so different was not the number of tornadoes, but the strength of them. 15 tornadoes cut paths across arkansas. ten of them were ef2 or stronger. the evening began with a supercell spawning a tornado in baxter county near the missouri border, and then a monster supercell that crossed us 65 near leslie put down a large ef four tornado that went through 56 bellevue and violet hill before lifting southeast of ash flat. this tornado was over three fourths of a mile wide. confirmed large tornado. this is likely a strong tornado just calling out a few places that likely could have been impacted. this storm went on a short time later to produce another large ef three tornado that tore through ravenden springs before moving into missouri. the next round of storms dropped to ef three tornado that moved through cushman cave city, <span class=""highlight"">blackrock</span>, and rainbow before lifting",USD,1,60,20250328222959,News,14088390904,1359.0,71200.0,"Mar 28, 2025 05:16 PM CDT",http://lr101.assets.criticalmention.com/flv_stream.php?filename=76%2F20250328220000%2F20250328220000_full.flv&start=960&duration=60&hmac=508a52d85399463040b27c6688d57a5b620ed822fd1a1466e97ca269e73a6239&exp=1743374236,https://lr101.assets.criticalmention.com/stream.php?channel_id=76&start=1743200160000&stop=1743200220000&fmt=m3u8&exp=1743374236&user_id=2248&hmac=1054f4cbd7ed6fda03bb13fa8be292f174ec91f12cafb28beccf125091cebe63,Local,https,1359.0,Local,20250328220000,False,America/New_York,BlackRock / Fink,TV,,,video/x-flv,,,4358,20740,20740.0,,-0.34239688515663147,https://s3.us-east-2.amazonaws.com/media.cm.com/outlets/20740.jpg,76,57,United States,Little Rock,58,AR,00327290,https://lr101.assets.criticalmention.com/76/20250328220000/20250328221600.jpg,,"uuid=335580c2-00ca-4c54-96f5-a4606c9cda73&channelId=76&minTime=20250328220000&maxTime=20250328222959&token=0131da76-3a1a-465a-a39b-88248ca08854&keyword=lawrence%20fink,blackrock,larry%20fink,laurence%20fink,black%20rock","https://app.criticalmention.com/cm/wordplay?uuid=335580c2-00ca-4c54-96f5-a4606c9cda73&channelId=76&minTime=20250328220000&maxTime=20250328222959&token=0131da76-3a1a-465a-a39b-88248ca08854&keyword=lawrence%20fink,blackrock,larry%20fink,laurence%20fink,black%20rock",https://app.criticalmention.com/cm/wordplay?uuid=335580c2-00ca-4c54-96f5-a4606c9cda73&channelId=76&minTime=20250328220000&maxTime=20250328222959&token=0131da76-3a1a-465a-a39b-88248ca08854
