affiliate,author,cc_text_hi_words,language,text,time,timestamp,title,uuid,cm_outlet_id,post_type,contacts,channelName,thumbnailUrl,audience,broadcast_tz,callsign,cc_text,currency_code,data_source_id,duration,end_time,genre,id,local_publicity,local_audience,local_time,legacy_media,media,program_type,protocol,publicity,source_type,start_time,text_only,timezone,alert_name,alias,author_id,copyright,mime_type,topics,content_url,alert_id,media_outlet_id,media_outlet_id_channel,media_outlet_id_program,sentiment,outlet_logo_url,channel_id,market_id,market_country,market_name,market_rank,market_state,program_id,thumbnail,cc_text_hi,relative_media_url,media_url,media_url_no_highlight
CNBC Europe,,"etf,ishares,i-shares,etfs,etf's,e-t-f,e-t-f-s",English,"composite to a level of seventeen thousand three thirty nine as we take a look at how that large cap tech trade is playing out we've been watching the invesco qqq trust which tracks the large cap one hundred of the nasdaq index we are now roughly five percent below that two hundred day moving average longer term trend line and roughly thirteen percent below the record highs that we saw over the course of the last couple of months that move here in big cap technology is one that a lot of traders are watching to see if they can find any kind of support around these current levels and if you're looking for another place in the marketplace right now that we are keeping a very close in it's the interest rate complex right now yield or believe it or not a little bit lower from where they were yesterday the two year note you three point nine two percent the ten year note you'll four point two six percent and the <span class=""highlight"">ishares</span> twenty year long bond up one and a half percent all despite some of those inflationary numbers out this morning which took a little bit higher hotter than expected one place we are continuing to see flows into a safe haven basis",2025-03-28 13:02:00,2025-03-28 17:02:00,The Exchange,02e000a2-f375-5586-bc86-461f9c306530,,Network,"[{'first_name': 'Kelly', 'last_name': 'Evans', 'roles': ['Anchor'], 'contact_id': None}]",CNBC Europe,https://muk05.assets.criticalmention.com/20006/20250328170000/20250328170200.jpg,,UTC,CNBCEU,"composite to a level of seventeen thousand three thirty nine as we take a look at how that large cap tech trade is playing out we've been watching the invesco qqq trust which tracks the large cap one hundred of the nasdaq index we are now roughly five percent below that two hundred day moving average longer term trend line and roughly thirteen percent below the record highs that we saw over the course of the last couple of months that move here in big cap technology is one that a lot of traders are watching to see if they can find any kind of support around these current levels and if you're looking for another place in the marketplace right now that we are keeping a very close in it's the interest rate complex right now yield or believe it or not a little bit lower from where they were yesterday the two year note you three point nine two percent the ten year note you'll four point two six percent and the <span class=""highlight"">ishares</span> twenty year long bond up one and a half percent all despite some of those inflationary numbers out this morning which took a little bit higher hotter than expected one place we are continuing to see flows into a safe haven basis",,1,60,20250328172959,Bus./financial News,7165375388311807976,,,"Mar 28, 2025 05:02 PM UTC",http://muk05.assets.criticalmention.com/flv_stream.php?filename=20006%2F20250328170000%2F20250328170000_full.flv&start=120&duration=60&hmac=1261388eec0c980774cd98aca6fe4674d6ef013fb314fc8e2b0e19dbd1514270&exp=1743374236,https://muk05.assets.criticalmention.com/stream.php?channel_id=20006&start=1743181320000&stop=1743181380000&fmt=m3u8&exp=1743374236&user_id=2248&hmac=a477fcb69ee4758a66e1b395926ee79314717b377dabdcb55c73d2a355e2722c,Network,https,,Network,20250328170000,False,America/New_York,iShares (1),TV,,,video/x-flv,,,89440,8784,8784.0,,0.050640005618333817,https://pbs.twimg.com/profile_images/1788964839047491585/sheVMP_-.jpg,20006,214,United Kingdom,United Kingdom,214,,03137016,https://muk05.assets.criticalmention.com/20006/20250328170000/20250328170200.jpg,,"uuid=02e000a2-f375-5586-bc86-461f9c306530&channelId=20006&minTime=20250328170000&maxTime=20250328172959&token=0131da76-3a1a-465a-a39b-88248ca08854&keyword=etf,ishares,i-shares,etfs,etf%27s,e-t-f,e-t-f-s","https://app.criticalmention.com/cm/wordplay?uuid=02e000a2-f375-5586-bc86-461f9c306530&channelId=20006&minTime=20250328170000&maxTime=20250328172959&token=0131da76-3a1a-465a-a39b-88248ca08854&keyword=etf,ishares,i-shares,etfs,etf's,e-t-f,e-t-f-s",https://app.criticalmention.com/cm/wordplay?uuid=02e000a2-f375-5586-bc86-461f9c306530&channelId=20006&minTime=20250328170000&maxTime=20250328172959&token=0131da76-3a1a-465a-a39b-88248ca08854
CNBC,,"etf,ishares,i-shares,etfs,etf's,e-t-f,e-t-f-s",English,"heavier side of things down 2.5%. That's 465 points off the Nasdaq Composite to a level of 17,003 39. As we take a look at how that large cap tech trade is playing out, we've been watching the Invesco Q-q-q trust, which tracks the large cap 100 of the Nasdaq index. We are now roughly 5% below that 200 day moving average, longer term trend line, and roughly 13% below the record highs that we saw over the course of the last couple of months. That move here in big cap technology is one that a lot of traders are watching to see if they can find any kind of support around these current levels. And if you're looking for another place in the marketplace right now that we are keeping a very close eye on, it's the interest rate complex right now. Yields are, believe it or not, a little bit lower from where they were yesterday. The two year note yield 3.92%. The ten year note yield 4.26%. And the <span class=""highlight"">iShares</span> 20 Year Long Bond <span class=""highlight"">etf</span>, ticker tlt, up 1.5%, all despite some of those inflationary numbers out this morning, which ticked a little bit higher. Hotter than",2025-03-28 13:02:00,2025-03-28 17:02:00,The Exchange,10071e65-431f-4058-ab1c-118b7f26eefb,,Network,"[{'first_name': 'Kelly', 'last_name': 'Evans', 'roles': ['Anchor'], 'contact_id': '14ad758a-647d-46f0-a323-3a7bb9da4bbd'}]",CNBC,https://ny98.assets.criticalmention.com/8062/20250328170000/20250328170200.jpg,213530.0,America/New_York,CNBC,"heavier side of things down 2.5%. That's 465 points off the Nasdaq Composite to a level of 17,003 39. As we take a look at how that large cap tech trade is playing out, we've been watching the Invesco Q-q-q trust, which tracks the large cap 100 of the Nasdaq index. We are now roughly 5% below that 200 day moving average, longer term trend line, and roughly 13% below the record highs that we saw over the course of the last couple of months. That move here in big cap technology is one that a lot of traders are watching to see if they can find any kind of support around these current levels. And if you're looking for another place in the marketplace right now that we are keeping a very close eye on, it's the interest rate complex right now. Yields are, believe it or not, a little bit lower from where they were yesterday. The two year note yield 3.92%. The ten year note yield 4.26%. And the <span class=""highlight"">iShares</span> 20 Year Long Bond <span class=""highlight"">etf</span>, ticker tlt, up 1.5%, all despite some of those inflationary numbers out this morning, which ticked a little bit higher. Hotter than",USD,1,60,20250328175959,Bus./financial News,14087945622,,,"Mar 28, 2025 01:02 PM EDT",http://ny98.assets.criticalmention.com/flv_stream.php?filename=8062%2F20250328170000%2F20250328170000_full.flv&start=120&duration=60&hmac=20b8b6af4335054ba34350a38631132d3f31796c9dd617aa882cd2ba16bf1906&exp=1743374236,https://ny98.assets.criticalmention.com/stream.php?channel_id=8062&start=1743181320000&stop=1743181380000&fmt=m3u8&exp=1743374236&user_id=2248&hmac=320aad9a7c19585a21fc7df4ff3a7adf3a14bb533aea39c843ee8e4076f44228,Network,https,18123.0,Network,20250328170000,False,America/New_York,iShares (1),TV,,,video/x-flv,,,89440,8781,8781.0,,-0.03775999695062637,https://pbs.twimg.com/profile_images/1734317789597540352/2jMsl8hP.jpg,8062,211,United States,National Programming,0,,03123741,https://ny98.assets.criticalmention.com/8062/20250328170000/20250328170200.jpg,,"uuid=10071e65-431f-4058-ab1c-118b7f26eefb&channelId=8062&minTime=20250328170000&maxTime=20250328175959&token=0131da76-3a1a-465a-a39b-88248ca08854&keyword=etf,ishares,i-shares,etfs,etf%27s,e-t-f,e-t-f-s","https://app.criticalmention.com/cm/wordplay?uuid=10071e65-431f-4058-ab1c-118b7f26eefb&channelId=8062&minTime=20250328170000&maxTime=20250328175959&token=0131da76-3a1a-465a-a39b-88248ca08854&keyword=etf,ishares,i-shares,etfs,etf's,e-t-f,e-t-f-s",https://app.criticalmention.com/cm/wordplay?uuid=10071e65-431f-4058-ab1c-118b7f26eefb&channelId=8062&minTime=20250328170000&maxTime=20250328175959&token=0131da76-3a1a-465a-a39b-88248ca08854
Bloomberg,,"lawrence fink,blackrock,larry fink,laurence fink,black rock",English,"coming to the end of the quarter, how was the quarter for you? where do we end the year on the 10 year? molly: yeah, this quarter is definitely very volatile. we saw a shift from the question of, is the economy reacts to are we going into a recession? -- is the economy reacts seller to are we going into a recession -- re-accelerating to are we going into a recession very quickly. david: i say 4.5 on the 10 year is a fair level with the 50 basis point band around that. i think that you're going to see continued pressure and termites on the back of the deficit. vonnie: we will give you a reprieve given that we have one more session in the quarter. that is molly brooks of td securities and david of <span class=""highlight"">blackrock</span>. next, the auction block. even with all of this market volatility u.s. high-grade",2025-03-28 12:11:00,2025-03-28 16:11:00,Bloomberg Real Yield,f07c5aaf-cd28-42c0-9569-f3b26ba6193d,,Network,"[{'first_name': 'Jonathan', 'last_name': 'Ferro', 'roles': ['Host'], 'contact_id': None}]",Bloomberg,https://ny96.assets.criticalmention.com/8063/20250328160000/20250328161100.jpg,,America/New_York,BLOOM,"coming to the end of the quarter, how was the quarter for you? where do we end the year on the 10 year? molly: yeah, this quarter is definitely very volatile. we saw a shift from the question of, is the economy reacts to are we going into a recession? -- is the economy reacts seller to are we going into a recession -- re-accelerating to are we going into a recession very quickly. david: i say 4.5 on the 10 year is a fair level with the 50 basis point band around that. i think that you're going to see continued pressure and termites on the back of the deficit. vonnie: we will give you a reprieve given that we have one more session in the quarter. that is molly brooks of td securities and david of <span class=""highlight"">blackrock</span>. next, the auction block. even with all of this market volatility u.s. high-grade",,1,60,20250328162959,News Bus./financial,14087873919,,,"Mar 28, 2025 12:11 PM EDT",http://ny96.assets.criticalmention.com/flv_stream.php?filename=8063%2F20250328160000%2F20250328160000_full.flv&start=660&duration=60&hmac=c5643a935d0e48447382c6b4b1531c1fb02ca900fce8109c61410e4225a1c074&exp=1743374236,https://ny96.assets.criticalmention.com/stream.php?channel_id=8063&start=1743178260000&stop=1743178320000&fmt=m3u8&exp=1743374236&user_id=2248&hmac=34bc270a2c5954f897c670aa10e813a5ee2f9fedeb809b506d1267f4a0b209b9,Network,https,,Network,20250328160000,False,America/New_York,BlackRock / Fink,TV,,,video/x-flv,,,4358,55499,55499.0,,-0.18183313310146332,https://s3.us-east-2.amazonaws.com/media.cm.com/outlets/55499.jpg,8063,211,United States,National Programming,0,,02634254,https://ny96.assets.criticalmention.com/8063/20250328160000/20250328161100.jpg,,"uuid=f07c5aaf-cd28-42c0-9569-f3b26ba6193d&channelId=8063&minTime=20250328160000&maxTime=20250328162959&token=0131da76-3a1a-465a-a39b-88248ca08854&keyword=lawrence%20fink,blackrock,larry%20fink,laurence%20fink,black%20rock","https://app.criticalmention.com/cm/wordplay?uuid=f07c5aaf-cd28-42c0-9569-f3b26ba6193d&channelId=8063&minTime=20250328160000&maxTime=20250328162959&token=0131da76-3a1a-465a-a39b-88248ca08854&keyword=lawrence%20fink,blackrock,larry%20fink,laurence%20fink,black%20rock",https://app.criticalmention.com/cm/wordplay?uuid=f07c5aaf-cd28-42c0-9569-f3b26ba6193d&channelId=8063&minTime=20250328160000&maxTime=20250328162959&token=0131da76-3a1a-465a-a39b-88248ca08854
Bloomberg Europe,,"lawrence fink,blackrock,larry fink,laurence fink,black rock",English,"as we saw a kind of a shift from the question of is the economy of accelerating to are we going into a recession and we saw that very quickly turn within the mark and the tenure at the end of the year we see it lower with fed rate cuts from july through the end of the year davis always tough with the point institute but i'd say you know i think four and half on the ten year is a pretty fair level with a fifty basis point band around that i think you know i think you're going to see continued pressure and term rates on the all right and we'll give you a reprieve on the house the quarter for you question given that we do to have one more session in the quarter much appreciated that is molly book of securities and david robe of <span class=""highlight"">black rock</span> of next the auction block even with all this recent market volatility us high grade issuance have notched the highest level for volume for a first quarter ever we talk credit next this is real yield on berk",2025-03-28 12:11:00,2025-03-28 16:11:00,Bloomberg Real Yield,6463db70-881b-57a4-9ebe-6876295daf94,,Network,"[{'first_name': 'Jonathan', 'last_name': 'Ferro', 'roles': ['Host'], 'contact_id': None}, {'first_name': 'David', 'last_name': 'Westin', 'roles': ['Host'], 'contact_id': None}]",Bloomberg Europe,https://muk20.assets.criticalmention.com/20114/20250328160000/20250328161100.jpg,0.0,UTC,BLOMUK,"as we saw a kind of a shift from the question of is the economy of accelerating to are we going into a recession and we saw that very quickly turn within the mark and the tenure at the end of the year we see it lower with fed rate cuts from july through the end of the year davis always tough with the point institute but i'd say you know i think four and half on the ten year is a pretty fair level with a fifty basis point band around that i think you know i think you're going to see continued pressure and term rates on the all right and we'll give you a reprieve on the house the quarter for you question given that we do to have one more session in the quarter much appreciated that is molly book of securities and david robe of <span class=""highlight"">black rock</span> of next the auction block even with all this recent market volatility us high grade issuance have notched the highest level for volume for a first quarter ever we talk credit next this is real yield on berk",GBP,1,60,20250328162959,News Bus./financial,2455408154104739367,,,"Mar 28, 2025 04:11 PM UTC",http://muk20.assets.criticalmention.com/flv_stream.php?filename=20114%2F20250328160000%2F20250328160000_full.flv&start=660&duration=60&hmac=ec58c07af3c893ffba62b30051931097e2d389e59cb23355d3326f0a88ed907c&exp=1743374236,https://muk20.assets.criticalmention.com/stream.php?channel_id=20114&start=1743178260000&stop=1743178320000&fmt=m3u8&exp=1743374236&user_id=2248&hmac=bdfc8eeb817e30300a8f00ef9cd47e6c47256c51ad48be108fa043bcec510721,Network,https,0.0,Network,20250328160000,False,America/New_York,BlackRock / Fink,TV,,,video/x-flv,,,4358,396575,396575.0,,0.3844524919986725,,20114,214,United Kingdom,United Kingdom,214,,02630185,https://muk20.assets.criticalmention.com/20114/20250328160000/20250328161100.jpg,,"uuid=6463db70-881b-57a4-9ebe-6876295daf94&channelId=20114&minTime=20250328160000&maxTime=20250328162959&token=0131da76-3a1a-465a-a39b-88248ca08854&keyword=lawrence%20fink,blackrock,larry%20fink,laurence%20fink,black%20rock","https://app.criticalmention.com/cm/wordplay?uuid=6463db70-881b-57a4-9ebe-6876295daf94&channelId=20114&minTime=20250328160000&maxTime=20250328162959&token=0131da76-3a1a-465a-a39b-88248ca08854&keyword=lawrence%20fink,blackrock,larry%20fink,laurence%20fink,black%20rock",https://app.criticalmention.com/cm/wordplay?uuid=6463db70-881b-57a4-9ebe-6876295daf94&channelId=20114&minTime=20250328160000&maxTime=20250328162959&token=0131da76-3a1a-465a-a39b-88248ca08854
CNBC,,"lawrence fink,blackrock,larry fink,laurence fink,black rock",English,"growth side of the s&p 500. They have over the last couple of years. And that was the right move. >> Financials are down 5% this month. >> But. >> Still up 3% for the year. >> Yeah but you're down 5% this month. >> Yeah. But the s&p is down 5% and the financials are up 3%. That's an 800 basis. >> Point swing. >> So i talked to Rick Rieder yesterday of <span class=""highlight"">Blackrock</span> on the closing bell, who in his mind really summed up i think what a lot of people are feeling right now related to these markets. Take a listen. >> We're in. >> This. >> Incredible period of uncertainty. And i think the. >> Data. >> Particularly corporate data over the next couple of months, is going to reflect the fact that people are sitting on their hands. You're in this period of stasis and uncertainty. >> So as an investor. >> You know, what do you do? You take your. >> Beta down a little bit. >> You manage your risk. >> Down a little. >> Bit, you buy some options to create some upside convexity in the portfolio. But i think you got to you know, i always said, you know, instead of trying to hedge everything, just just hunker down a little bit, take a",2025-03-28 12:05:00,2025-03-28 16:05:00,Halftime Report,b930b5a5-931b-4b2c-9c54-381a34e647e4,,Network,"[{'first_name': 'Andy', 'last_name': 'Barsh', 'roles': ['Director'], 'contact_id': None}, {'first_name': 'Mary', 'last_name': 'Duffy', 'roles': ['Executive Producer'], 'contact_id': None}, {'first_name': 'Boaz', 'last_name': 'Halaban', 'roles': ['Producer'], 'contact_id': None}, {'first_name': 'Susan', 'last_name': 'Krakower', 'roles': ['Executive Producer'], 'contact_id': None}, {'first_name': 'David', 'last_name': 'Sartorius', 'roles': ['Producer'], 'contact_id': None}, {'first_name': 'Scott', 'last_name': 'Wapner', 'roles': ['Host'], 'contact_id': '618f39da-3d7e-48a5-a0ca-4efa9cc5d997'}]",CNBC,https://ny98.assets.criticalmention.com/8062/20250328160000/20250328160500.jpg,293163.0,America/New_York,CNBC,"growth side of the s&p 500. They have over the last couple of years. And that was the right move. >> Financials are down 5% this month. >> But. >> Still up 3% for the year. >> Yeah but you're down 5% this month. >> Yeah. But the s&p is down 5% and the financials are up 3%. That's an 800 basis. >> Point swing. >> So i talked to Rick Rieder yesterday of <span class=""highlight"">Blackrock</span> on the closing bell, who in his mind really summed up i think what a lot of people are feeling right now related to these markets. Take a listen. >> We're in. >> This. >> Incredible period of uncertainty. And i think the. >> Data. >> Particularly corporate data over the next couple of months, is going to reflect the fact that people are sitting on their hands. You're in this period of stasis and uncertainty. >> So as an investor. >> You know, what do you do? You take your. >> Beta down a little bit. >> You manage your risk. >> Down a little. >> Bit, you buy some options to create some upside convexity in the portfolio. But i think you got to you know, i always said, you know, instead of trying to hedge everything, just just hunker down a little bit, take a",USD,1,60,20250328165959,Bus./financial News Public affairs Interview,14087865339,,,"Mar 28, 2025 12:05 PM EDT",http://ny98.assets.criticalmention.com/flv_stream.php?filename=8062%2F20250328160000%2F20250328160000_full.flv&start=300&duration=60&hmac=289a944fe14e3343c4ea34cb47237769143bf3741d7faca7d53b572469daae66&exp=1743374236,https://ny98.assets.criticalmention.com/stream.php?channel_id=8062&start=1743177900000&stop=1743177960000&fmt=m3u8&exp=1743374236&user_id=2248&hmac=f60cfeac89c79e8913faf378da7a3075bf69033c76fbffdfaa5d7aabb77c7fc4,Network,https,24732.0,Network,20250328160000,False,America/New_York,BlackRock / Fink,TV,,,video/x-flv,,,4358,8781,8781.0,,-0.08459246158599854,https://pbs.twimg.com/profile_images/1734317789597540352/2jMsl8hP.jpg,8062,211,United States,National Programming,0,,04335957,https://ny98.assets.criticalmention.com/8062/20250328160000/20250328160500.jpg,,"uuid=b930b5a5-931b-4b2c-9c54-381a34e647e4&channelId=8062&minTime=20250328160000&maxTime=20250328165959&token=0131da76-3a1a-465a-a39b-88248ca08854&keyword=lawrence%20fink,blackrock,larry%20fink,laurence%20fink,black%20rock","https://app.criticalmention.com/cm/wordplay?uuid=b930b5a5-931b-4b2c-9c54-381a34e647e4&channelId=8062&minTime=20250328160000&maxTime=20250328165959&token=0131da76-3a1a-465a-a39b-88248ca08854&keyword=lawrence%20fink,blackrock,larry%20fink,laurence%20fink,black%20rock",https://app.criticalmention.com/cm/wordplay?uuid=b930b5a5-931b-4b2c-9c54-381a34e647e4&channelId=8062&minTime=20250328160000&maxTime=20250328165959&token=0131da76-3a1a-465a-a39b-88248ca08854
